{
  "$schema": "../../schemas/json/mission.schema.json",
  "name": "Timothy for Change",
  "mission": "Analysing Structural Violence",
  "description": "Unmasking the roots of global crises often labelled \"humanitarian.\" We examine how colonialism, imperialism, and neoliberal capitalism create and perpetuate sufferingâ€”from Palestine to the Sahel. This site provides critical analysis of the political and economic systems driving displacement, famine, and state collapse, aiming to equip readers for informed action against systemic injustice.",
  "links": [
    {
      "url": "https://www.givedirectly.org",
      "icon": "hand-coin-line",
      "title": "GiveDirectly",
      "description": "A non-profit that sends cash directly to people living in extreme poverty, empowering them to make choices that improve their lives on their own terms."
    },
    {
      "url": "https://sharethemeal.org",
      "icon": "restaurant-2-line",
      "title": "ShareTheMeal",
      "description": "A simple, tech-driven way to provide meals to children and families in crisis, connecting everyday actions to global hunger relief."
    },
    {
      "url": "https://www.wateraid.org/",
      "icon": "drop-line",
      "title": "WaterAid",
      "description": "An international non-profit working to ensure clean water, decent toilets, and good hygiene are accessible to all, tackling inequalities in health and infrastructure."
    }
  ]
}
